{
  "adapter_port_version": "1.0",
  "artifact_id": "fixture-artifact",
  "artifact_revision": "r1",
  "artifact_sha256": "aaaaaaaaaaaaaaaaaaaaaaaaaaaaaaaaaaaaaaaaaaaaaaaaaaaaaaaaaaaaaaaa",
  "contains_credentials": false,
  "created_at": "2026-08-31T19:00:00Z",
  "external_side_effects": false,
  "human_approval": {
    "action": "approve",
    "action_id": "11111111-1111-4111-8111-111111111111",
    "action_ref": {
      "artifact_ref": "outbox/review-actions/fixture-artifact/r1.json",
      "artifact_revision": "11111111-1111-4111-8111-111111111111",
      "artifact_sha256": "bbbbbbbbbbbbbbbbbbbbbbbbbbbbbbbbbbbbbbbbbbbbbbbbbbbbbbbbbbbbbbbb"
    },
    "recorded_at": "2026-08-31T19:00:00Z"
  },
  "lineage": {
    "artifact_ref": "outbox/lineage/fixture-artifact/r1.json",
    "artifact_revision": "r1",
    "artifact_sha256": "cccccccccccccccccccccccccccccccccccccccccccccccccccccccccccccccc"
  },
  "origin_artifact": {
    "artifact_ref": "records/decisions/FIX-1/final-r1.md",
    "artifact_revision": "r1",
    "artifact_sha256": "aaaaaaaaaaaaaaaaaaaaaaaaaaaaaaaaaaaaaaaaaaaaaaaaaaaaaaaaaaaaaaaa"
  },
  "project_id": "example-project",
  "project_profile_revision": "example-project-profile-v2",
  "release_id": "22222222-2222-4222-8222-222222222222",
  "release_package_version": "1.0",
  "review_manifest": {
    "artifact_ref": "outbox/pending/fixture-artifact/r1.json",
    "artifact_revision": "r1",
    "artifact_sha256": "dddddddddddddddddddddddddddddddddddddddddddddddddddddddddddddddd"
  },
  "root_writer_receipts": [
    {
      "artifact_ref": "clockwork/run-receipts/RUN-FIXTURE-001/writer-33333333-3333-4333-8333-333333333333.json",
      "artifact_revision": "RUN-FIXTURE-001",
      "artifact_sha256": "eeeeeeeeeeeeeeeeeeeeeeeeeeeeeeeeeeeeeeeeeeeeeeeeeeeeeeeeeeeeeeee"
    },
    {
      "artifact_ref": "clockwork/run-receipts/review-fixture/writer-44444444-4444-4444-8444-444444444444.json",
      "artifact_revision": "review-fixture",
      "artifact_sha256": "ffffffffffffffffffffffffffffffffffffffffffffffffffffffffffffffff"
    }
  ],
  "source_artifact": {
    "artifact_ref": "outbox/artifacts/fixture-artifact/r1.md",
    "artifact_revision": "r1",
    "artifact_sha256": "aaaaaaaaaaaaaaaaaaaaaaaaaaaaaaaaaaaaaaaaaaaaaaaaaaaaaaaaaaaaaaaa"
  },
  "source_run_id": "RUN-FIXTURE-001"
}
